{
 "$schema": "./oracle-corpus.schema.json",
 "name": "Hidane Oracle Corpus",
 "description": "The official Cloud Firestore emulator's answers that hidane records, replays and compares: every recording, how it was made, the release it was made against, and how its answers are compared. See docs/oracle-corpus.md.",
 "schema_version": 1,
 "generated_by": "tools/oracle/corpus.py",
 "digest": "sha256:cfd73c2a5b5f2fbe01d5b27d1e6372138fea53018649eab84cc21c78ed458f13",
 "releases": [
  {
   "product": "cloud-firestore-emulator",
   "release": "v1.22.0",
   "jar_sha256": "9b6498b7f62714d67f48f59b3818883cd682dbcd46b9f59511de81c97bb5166c",
   "pinned": true
  }
 ],
 "totals": {
  "files": 81,
  "fixtures": 49,
  "transcripts": 32,
  "answers": 23875,
  "bytes": 14122665,
  "levels": {
   "full": 13309,
   "reasons": 4344,
   "part": 843,
   "status": 5187,
   "codes": 30,
   "none": 1,
   "differs": 161
  },
  "by_area": {
   "documents": {
    "fixtures": 8,
    "transcripts": 4,
    "answers": 5749
   },
   "queries": {
    "fixtures": 4,
    "transcripts": 7,
    "answers": 924
   },
   "transactions": {
    "fixtures": 1,
    "transcripts": 5,
    "answers": 215
   },
   "streams": {
    "fixtures": 1,
    "transcripts": 6,
    "answers": 49
   },
   "rest": {
    "fixtures": 2,
    "transcripts": 1,
    "answers": 550
   },
   "webchannel": {
    "fixtures": 1,
    "transcripts": 3,
    "answers": 34
   },
   "rules": {
    "fixtures": 23,
    "transcripts": 2,
    "answers": 15366
   },
   "export": {
    "fixtures": 1,
    "transcripts": 1,
    "answers": 70
   },
   "admin": {
    "fixtures": 3,
    "transcripts": 3,
    "answers": 640
   },
   "values": {
    "fixtures": 5,
    "transcripts": 0,
    "answers": 278
   }
  },
  "by_release": {
   "v1.22.0": {
    "fixtures": 49,
    "transcripts": 32,
    "answers": 23875
   }
  },
  "by_release_source": {
   "header": 24,
   "file name": 33,
   "git history": 24
  }
 },
 "recordings": [
  {
   "path": "crates/hidane/tests/fixtures/base_versions.json",
   "kind": "fixture",
   "area": "documents",
   "recorder": "tools/oracle/base_versions.py",
   "client": {
    "over": [
     "REST"
    ],
    "using": "Python standard library",
    "packages": []
   },
   "oracle": {
    "release": "v1.22.0",
    "jar_sha256": "9b6498b7f62714d67f48f59b3818883cd682dbcd46b9f59511de81c97bb5166c",
    "source": "header"
   },
   "recorded": {
    "first_recorded": "2026-10-14",
    "last_changed": "2026-10-14"
   },
   "bytes": 118931,
   "sha256": "85fcb3d681b3cc816f1cbca516fd41844e905bb8b7e63c59c6002dc364c32168",
   "answers": 222,
   "levels": {
    "full": 95,
    "status": 126,
    "differs": 1
   },
   "replayed_over": [
    "REST"
   ],
   "tests": [
    "crates/hidane/tests/base_versions.rs::update_time_preconditions_like_the_official_emulator"
   ],
   "counted": "each call",
   "compared": "an error in full (code and message, its versions those of hidane's own commits), but a missing document on its code (its message prints the official emulator's internal key, an intentional difference); a success on its status; REST's `currentDocument.updateTime` parameter as intentionally different"
  },
  {
   "path": "crates/hidane/tests/fixtures/commit_checks.json",
   "kind": "fixture",
   "area": "documents",
   "recorder": "tools/oracle/commit_checks.py",
   "client": {
    "over": [
     "gRPC",
     "REST"
    ],
    "using": "Python standard library and grpcurl",
    "packages": []
   },
   "oracle": {
    "release": "v1.22.0",
    "jar_sha256": "9b6498b7f62714d67f48f59b3818883cd682dbcd46b9f59511de81c97bb5166c",
    "source": "header"
   },
   "recorded": {
    "first_recorded": "2026-10-13",
    "last_changed": "2026-10-13"
   },
   "bytes": 1115146,
   "sha256": "5abc1d8ff5707b231dc5e5b24de2749da275d64356d24da06e3e87df5c226444",
   "answers": 4664,
   "levels": {
    "full": 4616,
    "codes": 29,
    "differs": 19
   },
   "replayed_over": [
    "gRPC",
    "REST"
   ],
   "tests": [
    "crates/hidane/tests/commit_checks.rs::the_first_error_is_the_official_one",
    "crates/hidane/tests/commit_checks.rs::writes_to_another_database_are_refused"
   ],
   "counted": "each commit over each transport it was recorded over, and each step that writes to or reads after another database",
   "compared": "in full: the first error's code and message, the number of write results or `:batchWrite`'s statuses, a read's status, names found or missing; a failed precondition without its message (it prints the official emulator's internal key); the cases the test lists in `KNOWN` (array unions of arrays and of vectors with NaN) and the steps in `DIFFERS` (writes to another database, which hidane refuses, and the reads that follow) as intentionally different"
  },
  {
   "path": "crates/hidane/tests/fixtures/document_writes.json",
   "kind": "fixture",
   "area": "documents",
   "recorder": "tools/oracle/document_writes.py",
   "client": {
    "over": [
     "REST"
    ],
    "using": "Python standard library",
    "packages": []
   },
   "oracle": {
    "release": "v1.22.0",
    "jar_sha256": "9b6498b7f62714d67f48f59b3818883cd682dbcd46b9f59511de81c97bb5166c",
    "source": "header"
   },
   "recorded": {
    "first_recorded": "2026-10-10",
    "last_changed": "2026-10-10"
   },
   "bytes": 47497,
   "sha256": "ade0d3c75406e6254c0e28406d9fb06571ead9d14abeb6fb9991f090b79eebf6",
   "answers": 16,
   "levels": {
    "full": 16
   },
   "replayed_over": [
    "gRPC"
   ],
   "tests": [
    "crates/hidane/tests/documents.rs::reads_and_their_errors",
    "crates/hidane/tests/documents.rs::preconditions",
    "crates/hidane/tests/documents.rs::invalid_writes_use_the_official_messages",
    "crates/hidane/tests/documents.rs::listing_documents_and_collections",
    "crates/hidane/tests/documents.rs::batch_write_reports_each_write"
   ],
   "counted": "each recorded message the tests check hidane's against (they replay no case as a whole); recorded over REST",
   "compared": "in full: the code and the message (a stored version's timestamps masked)"
  },
  {
   "path": "crates/hidane/tests/fixtures/field_order.json",
   "kind": "fixture",
   "area": "documents",
   "recorder": "tools/oracle/field_order.py",
   "client": {
    "over": [
     "REST"
    ],
    "using": "Python standard library",
    "packages": []
   },
   "oracle": {
    "release": "v1.22.0",
    "jar_sha256": "9b6498b7f62714d67f48f59b3818883cd682dbcd46b9f59511de81c97bb5166c",
    "source": "git history",
    "evidence": "no header; tools/oracle/ names only cloud-firestore-emulator v1.22.0 at the commit that last changed it, as at the earlier commit that changed it"
   },
   "recorded": {
    "first_recorded": "2026-10-11",
    "last_changed": "2026-10-15"
   },
   "bytes": 144279,
   "sha256": "7c60fd248bec2be920084600170894273a7120994e1a4f94ec59b09d3670fdfc",
   "answers": 157,
   "levels": {
    "full": 1,
    "part": 85,
    "status": 71
   },
   "replayed_over": [
    "REST"
   ],
   "tests": [
    "crates/hidane/tests/field_order.rs::fields_come_back_in_the_official_order"
   ],
   "counted": "each call",
   "compared": "an error in full (status and message); a commit on its status; a read in part: the order of every field, nested ones included, and which commit its `updateTime` names, not the values"
  },
  {
   "path": "crates/hidane/tests/fixtures/list_documents.json",
   "kind": "fixture",
   "area": "documents",
   "recorder": "tools/oracle/list_documents.py",
   "client": {
    "over": [
     "gRPC",
     "REST"
    ],
    "using": "Python standard library and grpcurl",
    "packages": []
   },
   "oracle": {
    "release": "v1.22.0",
    "jar_sha256": "9b6498b7f62714d67f48f59b3818883cd682dbcd46b9f59511de81c97bb5166c",
    "source": "header"
   },
   "recorded": {
    "first_recorded": "2026-10-10",
    "last_changed": "2026-10-14"
   },
   "bytes": 16761,
   "sha256": "2638252112a72d34c0b4d3216feccf19d012df6fcd28429d5ae656298babe95c",
   "answers": 46,
   "levels": {
    "full": 44,
    "differs": 2
   },
   "replayed_over": [
    "gRPC",
    "REST"
   ],
   "tests": [
    "crates/hidane/tests/list_documents.rs::list_documents_like_the_official_emulator"
   ],
   "counted": "each case (a paged case is one)",
   "compared": "in full: the names of every page, or the code and message; a page token next to an order as intentionally different"
  },
  {
   "path": "crates/hidane/tests/fixtures/read_time_and_databases.json",
   "kind": "fixture",
   "area": "documents",
   "recorder": "tools/oracle/read_time_and_databases.py",
   "client": {
    "over": [
     "gRPC",
     "REST"
    ],
    "using": "Python standard library and grpcurl",
    "packages": []
   },
   "oracle": {
    "release": "v1.22.0",
    "jar_sha256": "9b6498b7f62714d67f48f59b3818883cd682dbcd46b9f59511de81c97bb5166c",
    "source": "header"
   },
   "recorded": {
    "first_recorded": "2026-10-14",
    "last_changed": "2026-10-14"
   },
   "bytes": 16886,
   "sha256": "15880027b74661f4ae75f48a8bbc6a66e8d9f038a2156b766604252aeb508e8d",
   "answers": 80,
   "levels": {
    "full": 53,
    "differs": 27
   },
   "replayed_over": [
    "gRPC",
    "REST"
   ],
   "tests": [
    "crates/hidane/tests/read_time_and_databases.rs::read_times_up_to_the_window",
    "crates/hidane/tests/read_time_and_databases.rs::databases_without_a_limit"
   ],
   "counted": "each read at each age, the statuses of the writes to every database as one, and each read back",
   "compared": "in full: the code, the message and the names of the documents (gRPC), or the status and the body with server times and transaction IDs masked (REST); the reads from further back than hidane keeps versions, and the REST `?readTime=` parameter, as intentionally different (docs/parity-exceptions.md)"
  },
  {
   "path": "crates/hidane/tests/fixtures/same_document_writes.json",
   "kind": "fixture",
   "area": "documents",
   "recorder": "tools/oracle/same_document_writes.py",
   "client": {
    "over": [